mobile num name
mobile num city
mobile num amount


create table namnum( m_number bigint, name varchar(30) );

create table citnum( cityname varchar(30), pincode int, m_number bigint not null primary key);
create table amonum( amount double, m_number bigint not null primary );


mysql> help ALTER TABLEALTER TABLE

Nothing found
Please try to run 'help contents' for a list of all accessible topics

mysql> ALTER TABLE
    -> namnum
    -> ;
Query OK, 0 rows affected (0.00 sec)

mysql> describe namnum;
+----------+-------------+------+-----+---------+-------+
| Field    | Type        | Null | Key | Default | Extra |
+----------+-------------+------+-----+---------+-------+
| m_number | bigint(20)  | YES  |     | NULL    |       |
| name     | varchar(30) | YES  |     | NULL    |       |
+----------+-------------+------+-----+---------+-------+
2 rows in set (0.00 sec)

mysql> ALTER TABLE namnum add constraint m_number primary key (m_number,name);
Query OK, 0 rows affected (0.01 sec)
Records: 0  Duplicates: 0  Warnings: 0

mysql> describe namnum;
+----------+-------------+------+-----+---------+-------+
| Field    | Type        | Null | Key | Default | Extra |
+----------+-------------+------+-----+---------+-------+
| m_number | bigint(20)  | NO   | PRI | 0       |       |
| name     | varchar(30) | NO   | PRI |         |       |
+----------+-------------+------+-----+---------+-------+
2 rows in set (0.00 sec)

mysql>  ALTER TABLE namnum add constraint m_number primary key (m_number);
ERROR 1068 (42000): Multiple primary key defined
mysql> ALTER TABLE namnum DROP constraint m_number;
ERROR 1064 (42000): You have an error in your SQL syntax; check the manual that corresponds to your MySQL server version for the right syntax to use near 'constraint m_number' at line 1
mysql> ALTER TABLE namnum DROP primary key;
Query OK, 0 rows affected (0.02 sec)
Records: 0  Duplicates: 0  Warnings: 0

mysql> describe namnum;
+----------+-------------+------+-----+---------+-------+
| Field    | Type        | Null | Key | Default | Extra |
+----------+-------------+------+-----+---------+-------+
| m_number | bigint(20)  | NO   |     | 0       |       |
| name     | varchar(30) | NO   |     |         |       |
+----------+-------------+------+-----+---------+-------+
2 rows in set (0.01 sec)

mysql> ALTER TABLE namnum add constraint m_number primary key (m_number);
Query OK, 0 rows affected (0.01 sec)
Records: 0  Duplicates: 0  Warnings: 0

mysql> describe namnum;
+----------+-------------+------+-----+---------+-------+
| Field    | Type        | Null | Key | Default | Extra |
+----------+-------------+------+-----+---------+-------+
| m_number | bigint(20)  | NO   | PRI | 0       |       |
| name     | varchar(30) | NO   |     |         |       |
+----------+-------------+------+-----+---------+-------+
2 rows in set (0.00 sec)

mysql> ALTER TABLE namnum add constraint m_number not null primary key (m_number);
ERROR 1064 (42000): You have an error in your SQL syntax; check the manual that corresponds to your MySQL server version for the right syntax to use near 'not null primary key (m_number)' at line 1
mysql> ALTER TABLE namnum add constraint m_number not null (m_number);
ERROR 1064 (42000): You have an error in your SQL syntax; check the manual that corresponds to your MySQL server version for the right syntax to use near 'not null (m_number)' at line 1
mysql> ALTER TABLE namnum DROP constraint m_number;
ERROR 1064 (42000): You have an error in your SQL syntax; check the manual that corresponds to your MySQL server version for the right syntax to use near 'constraint m_number' at line 1
mysql> ALTER TABLE namnum DROP primary key;
Query OK, 0 rows affected (0.01 sec)
Records: 0  Duplicates: 0  Warnings: 0

mysql> ALTER TABLE namnum add constraint m_number not null primary key (m_number);
ERROR 1064 (42000): You have an error in your SQL syntax; check the manual that corresponds to your MySQL server version for the right syntax to use near 'not null primary key (m_number)' at line 1
mysql> DROP TABLE namnum;
Query OK, 0 rows affected (0.00 sec)

mysql> create table namnum( m_number bigint not null primary key, name varchar(30) );
Query OK, 0 rows affected (0.03 sec)

mysql> describe table namnum;
ERROR 1064 (42000): You have an error in your SQL syntax; check the manual that corresponds to your MySQL server version for the right syntax to use near 'table namnum' at line 1
mysql> describe namnum;
+----------+-------------+------+-----+---------+-------+
| Field    | Type        | Null | Key | Default | Extra |
+----------+-------------+------+-----+---------+-------+
| m_number | bigint(20)  | NO   | PRI | NULL    |       |
| name     | varchar(30) | YES  |     | NULL    |       |
+----------+-------------+------+-----+---------+-------+
2 rows in set (0.00 sec)

mysql> create table citnum( cityname varchar(30), pincode int, m_number bigint not null primary key);
ERROR 1050 (42S01): Table 'citnum' already exists
mysql> DROP table citnum;
Query OK, 0 rows affected (0.00 sec)

mysql> create table citnum( cityname varchar(30), pincode int, m_number bigint not null primary key);
Query OK, 0 rows affected (0.01 sec)

mysql> describe citnum;
+----------+-------------+------+-----+---------+-------+
| Field    | Type        | Null | Key | Default | Extra |
+----------+-------------+------+-----+---------+-------+
| cityname | varchar(30) | YES  |     | NULL    |       |
| pincode  | int(11)     | YES  |     | NULL    |       |
| m_number | bigint(20)  | NO   | PRI | NULL    |       |
+----------+-------------+------+-----+---------+-------+
3 rows in set (0.00 sec)

mysql> describe amonum;
+----------+------------+------+-----+---------+-------+
| Field    | Type       | Null | Key | Default | Extra |
+----------+------------+------+-----+---------+-------+
| amount   | double     | YES  |     | NULL    |       |
| m_number | bigint(20) | NO   | PRI | NULL    |       |
+----------+------------+------+-----+---------+-------+
2 rows in set (0.00 sec)

mysql> load data local in file '/root/mysql/amonum.csv' into table amonum;
ERROR 1064 (42000): You have an error in your SQL syntax; check the manual that corresponds to your MySQL server version for the right syntax to use near 'in file '/root/mysql/amonum.csv' into table amonum' at line 1
mysql> load data local infile '/root/mysql/amonum.csv' into table amonum;
Query OK, 3 rows affected (0.09 sec)
Records: 3  Deleted: 0  Skipped: 0  Warnings: 0

mysql> select * from amonum;
+--------+------------+
| amount | m_number   |
+--------+------------+
|  500.5 | 9886736273 |
|    600 | 9847348234 |
|  900.5 | 8342342055 |
+--------+------------+
3 rows in set (0.00 sec)

mysql> describe citnum;
+----------+-------------+------+-----+---------+-------+
| Field    | Type        | Null | Key | Default | Extra |
+----------+-------------+------+-----+---------+-------+
| cityname | varchar(30) | YES  |     | NULL    |       |
| pincode  | int(11)     | YES  |     | NULL    |       |
| m_number | bigint(20)  | NO   | PRI | NULL    |       |
+----------+-------------+------+-----+---------+-------+
3 rows in set (0.00 sec)

mysql> load data local infile '/root/mysql/citnum.csv' into table citnum;
Query OK, 3 rows affected, 4 warnings (0.00 sec)
Records: 3  Deleted: 0  Skipped: 0  Warnings: 2

mysql> describe citnum;
+----------+-------------+------+-----+---------+-------+
| Field    | Type        | Null | Key | Default | Extra |
+----------+-------------+------+-----+---------+-------+
| cityname | varchar(30) | YES  |     | NULL    |       |
| pincode  | int(11)     | YES  |     | NULL    |       |
| m_number | bigint(20)  | NO   | PRI | NULL    |       |
+----------+-------------+------+-----+---------+-------+
3 rows in set (0.00 sec)

mysql> select * from citnum;
+-----------+---------+------------+
| cityname  | pincode | m_number   |
+-----------+---------+------------+
| bangalore |  560061 | 9886504855 |
| tumkur    |       0 |     560012 |
| mysuru    |       0 |     570034 |
+-----------+---------+------------+
3 rows in set (0.00 sec)

mysql> load data local infile '/root/mysql/citnum.csv' into table citnum;
Query OK, 0 rows affected, 4 warnings (0.00 sec)
Records: 3  Deleted: 0  Skipped: 3  Warnings: 2

mysql> select * from citnum;
+-----------+---------+------------+
| cityname  | pincode | m_number   |
+-----------+---------+------------+
| bangalore |  560061 | 9886504855 |
| tumkur    |       0 |     560012 |
| mysuru    |       0 |     570034 |
+-----------+---------+------------+
3 rows in set (0.00 sec)

mysql> load data local infile '/root/mysql/citnum.csv' into table citnum;
Query OK, 2 rows affected (0.00 sec)
Records: 3  Deleted: 0  Skipped: 1  Warnings: 0

mysql> select * from citnum;
+-----------+---------+------------+
| cityname  | pincode | m_number   |
+-----------+---------+------------+
| bangalore |  560061 | 9886504855 |
| tumkur    |       0 |     560012 |
| mysuru    |       0 |     570034 |
| tumkur    |  560012 | 9916914040 |
| mysuru    |  570034 | 9886736273 |
+-----------+---------+------------+
5 rows in set (0.00 sec)

mysql> delete * from citnum;
ERROR 1064 (42000): You have an error in your SQL syntax; check the manual that corresponds to your MySQL server version for the right syntax to use near '* from citnum' at line 1
mysql> delete from citnum;
Query OK, 5 rows affected (0.01 sec)

mysql> load data local infile '/root/mysql/citnum.csv' into table citnum;
Query OK, 3 rows affected (0.00 sec)
Records: 3  Deleted: 0  Skipped: 0  Warnings: 0

mysql> select * from citnum;
+-----------+---------+------------+
| cityname  | pincode | m_number   |
+-----------+---------+------------+
| bangalore |  560061 | 9886504855 |
| tumkur    |  560012 | 9916914040 |
| mysuru    |  570034 | 9886736273 |
+-----------+---------+------------+
3 rows in set (0.00 sec)

mysql> load data local infile '/root/mysql/namnum.csv' into table namnum;
Query OK, 3 rows affected (0.00 sec)
Records: 3  Deleted: 0  Skipped: 0  Warnings: 0

mysql> describe Ctrl-C -- exit!
Aborted
[root@mgm ~]# mysql
Welcome to the MySQL monitor.  Commands end with ; or \g.
Your MySQL connection id is 46
Server version: 5.1.73 Source distribution

Copyright (c) 2000, 2013, Oracle and/or its affiliates. All rights reserved.

Oracle is a registered trademark of Oracle Corporation and/or its
affiliates. Other names may be trademarks of their respective
owners.

Type 'help;' or '\h' for help. Type '\c' to clear the current input statement.

mysql> use mobile;
Reading table information for completion of table and column names
You can turn off this feature to get a quicker startup with -A

Database changed
mysql> select * from namnum;
+------------+---------+
| m_number   | name    |
+------------+---------+
| 9886736273 | pradeep |
| 9886504855 | Anupama |
| 9916914040 | Nagi    |
+------------+---------+
3 rows in set (0.00 sec)

mysql> select namnum.name,citnum.cityname,amonum.m_number from namnum citnum amonum where amonum.m_number=citnum.m_number
    -> ;
ERROR 1064 (42000): You have an error in your SQL syntax; check the manual that corresponds to your MySQL server version for the right syntax to use near 'amonum where amonum.m_number=citnum.m_number' at line 1
mysql> select citnum.cityname,amonum.m_number from citnum amonum where amonum.m_number=citnum.m_number
    -> ;
ERROR 1054 (42S22): Unknown column 'citnum.cityname' in 'field list'
mysql> describe citnum;
+----------+-------------+------+-----+---------+-------+
| Field    | Type        | Null | Key | Default | Extra |
+----------+-------------+------+-----+---------+-------+
| cityname | varchar(30) | YES  |     | NULL    |       |
| pincode  | int(11)     | YES  |     | NULL    |       |
| m_number | bigint(20)  | NO   | PRI | NULL    |       |
+----------+-------------+------+-----+---------+-------+
3 rows in set (0.00 sec)

mysql> select citnum.pincode,amonum.m_number from citnum amonum where amonum.m_number=citnum.m_number;
ERROR 1054 (42S22): Unknown column 'citnum.pincode' in 'field list'
mysql> select citnum.pincode,amonum.m_number from citnum,amonum where amonum.m_number=citnum.m_number;
+---------+------------+
| pincode | m_number   |
+---------+------------+
|  570034 | 9886736273 |
+---------+------------+
1 row in set (0.07 sec)

mysql> select citnum.cityname,amonum.m_number from citnum,amonum where amonum.m_number=citnum.m_number;
+----------+------------+
| cityname | m_number   |
+----------+------------+
| mysuru   | 9886736273 |
+----------+------------+
1 row in set (0.00 sec)

mysql> select namnum.name,citnum.cityname,amonum.m_number from namnum,citnum,amonum where amonum.m_number=citnum.m_number and namnum.m_number=citnum.m_number;
+---------+----------+------------+
| name    | cityname | m_number   |
+---------+----------+------------+
| pradeep | mysuru   | 9886736273 |
+---------+----------+------------+
1 row in set (0.00 sec)

mysql>
mysql>
